address,address_gu,address_dong,lat_long,lat,long
서울특별시 노원구 중계동 중계그린,노원구,중계동,"[37.6443713328952, 127.063281683752]",37.6443713328952,127.063281683752
서울특별시 노원구 상계동 상계1차중앙하이츠,노원구,상계동,"[37.6537415606119, 127.068905323896]",37.6537415606119,127.068905323896
서울특별시 서초구 방배동 방배대우효령,서초구,방배동,"[37.4795610823521, 126.993898555084]",37.4795610823521,126.993898555084
서울특별시 동작구 사당동 이수역리가,동작구,사당동,"[37.4894898027989, 126.973853272882]",37.4894898027989,126.973853272882
서울특별시 동대문구 휘경동 휘경주공1단지,동대문구,휘경동,"[37.5829871567703, 127.070747052227]",37.5829871567703,127.070747052227
서울특별시 동작구 본동 본동SH-ville,동작구,본동,"[37.5107860969186, 126.94970339468]",37.5107860969186,126.94970339468
서울특별시 은평구 진관동 은평뉴타운제각말5단지제4,은평구,진관동,"[37.6362276825971, 126.933104177994]",37.6362276825971,126.933104177994
서울특별시 노원구 공릉동 효성아파트,노원구,공릉동,"[37.6206662696947, 127.08867090156]",37.6206662696947,127.08867090156
서울특별시 강동구 암사동 강동현대홈타운,강동구,암사동,"[37.5565793525256, 127.138852308901]",37.5565793525256,127.138852308901
서울특별시 영등포구 문래동3가 문래자이아파트,영등포구,문래동3가,"[37.5161435802169, 126.896777740873]",37.5161435802169,126.896777740873
서울특별시 은평구 진관동 은평뉴타운마고정2단지,은평구,진관동,"[37.6334242331886, 126.923974377572]",37.6334242331886,126.923974377572
서울특별시 서초구 서초동 서초대우아이빌,서초구,서초동,"[37.4942413218619, 127.017558868696]",37.4942413218619,127.017558868696
서울특별시 중랑구 면목동 면목,중랑구,면목동,"[37.5736949139795, 127.087817678964]",37.5736949139795,127.087817678964
서울특별시 강동구 천호동 천호한신,강동구,천호동,"[37.5458256093034, 127.134867278695]",37.5458256093034,127.134867278695
서울특별시 도봉구 창동 창동성원,도봉구,창동,"[37.6608041595514, 127.049777485447]",37.6608041595514,127.049777485447
서울특별시 구로구 개봉동 개봉삼환,구로구,개봉동,"[37.4947561015806, 126.85445143621]",37.4947561015806,126.85445143621
서울특별시 동작구 신대방동 보라매아카데미타워아파트,동작구,신대방동,"[37.4913316020645, 126.924104833984]",37.4913316020645,126.924104833984
서울특별시 노원구 월계동 월계풍림아이원,노원구,월계동,"[37.6166125600718, 127.066759655645]",37.6166125600718,127.066759655645
서울특별시 노원구 월계동 월계서광,노원구,월계동,"[37.6231411562914, 127.064911846997]",37.6231411562914,127.064911846997
서울특별시 성북구 하월곡동 꿈의숲푸르지오,성북구,하월곡동,"[37.6107702871516, 127.038993186153]",37.6107702871516,127.038993186153
서울특별시 강북구 미아동 래미안미아1차,강북구,미아동,"[37.6260087812506, 127.01932742399]",37.6260087812506,127.01932742399
서울특별시 구로구 구로동 구로금호어울림,구로구,구로동,"[37.4998873159365, 126.892160177534]",37.4998873159365,126.892160177534
서울특별시 서대문구 연희동 연희대림아파트,서대문구,연희동,"[37.5754418305082, 126.936296369086]",37.5754418305082,126.936296369086
서울특별시 노원구 중계동 중계금호,노원구,중계동,"[37.6470266788091, 127.081276998765]",37.6470266788091,127.081276998765
서울특별시 성북구 종암동 종암아이파크1차,성북구,종암동,"[37.602534840189, 127.029865332341]",37.602534840189,127.029865332341
서울특별시 성북구 동소문동5가 돈암동일하이빌,성북구,동소문동5가,"[37.5916186082621, 127.014554680858]",37.5916186082621,127.014554680858
서울특별시 도봉구 방학동 방학동부센트레빌,도봉구,방학동,"[37.6633180819518, 127.039531579839]",37.6633180819518,127.039531579839
서울특별시 노원구 상계동 상계주공14단지,노원구,상계동,"[37.6691340218574, 127.057453609395]",37.6691340218574,127.057453609395
서울특별시 도봉구 창동 창동금용,도봉구,창동,"[37.6378479821145, 127.035668887436]",37.6378479821145,127.035668887436
서울특별시 양천구 신정동 신정세양청마루,양천구,신정동,"[37.5071533161833, 126.863675809775]",37.5071533161833,126.863675809775
서울특별시 강서구 내발산동 마곡수명산파크3단지,강서구,내발산동,"[37.5528192530167, 126.824912207374]",37.5528192530167,126.824912207374
서울특별시 강서구 방화동 방화1단지(장미),강서구,방화동,"[37.5742998188535, 126.81749374049]",37.5742998188535,126.81749374049
서울특별시 도봉구 방학동 방학신동아2단지,도봉구,방학동,"[37.6591075908242, 127.023416013429]",37.6591075908242,127.023416013429
서울특별시 서대문구 연희동 연희대우,서대문구,연희동,"[37.5615205693803, 126.929514782543]",37.5615205693803,126.929514782543
서울특별시 동대문구 휘경동 휘경 미소지움아파트,동대문구,휘경동,"[37.5915908857897, 127.064837218659]",37.5915908857897,127.064837218659
서울특별시 중구 신당동 파라다이스,중구,신당동,"[37.5623955702618, 127.017282610735]",37.5623955702618,127.017282610735
서울특별시 금천구 시흥동 관악산신도브래뉴,금천구,시흥동,"[37.4479379750889, 126.910620803071]",37.4479379750889,126.910620803071
서울특별시 강동구 상일동 상일동아,강동구,상일동,"[37.5461454174572, 127.167487349899]",37.5461454174572,127.167487349899
서울특별시 영등포구 신길동 보라매경남아너스빌,영등포구,신길동,"[37.4948797805032, 126.909888661947]",37.4948797805032,126.909888661947
서울특별시 은평구 응암동 녹번역센트레빌,은평구,응암동,"[37.5986184438228, 126.926703301824]",37.5986184438228,126.926703301824
서울특별시 송파구 방이동 방이코오롱,송파구,방이동,"[37.5086093984081, 127.122363991153]",37.5086093984081,127.122363991153
서울특별시 송파구 오금동 가락상아1차,송파구,오금동,"[37.4985544476068, 127.135337701813]",37.4985544476068,127.135337701813
서울특별시 구로구 오류동 오류한신플러스타운,구로구,오류동,"[37.4983857947892, 126.841022651244]",37.4983857947892,126.841022651244
서울특별시 서초구 서초동 신동아아파트,서초구,서초동,"[37.4921492413041, 127.023903060191]",37.4921492413041,127.023903060191
서울특별시 은평구 응암동 백련산힐스테이트임대,은평구,응암동,"[37.5895909636397, 126.925273631739]",37.5895909636397,126.925273631739
서울특별시 강동구 둔촌동 둔촌현대3차,강동구,둔촌동,"[37.5273638048142, 127.144872924375]",37.5273638048142,127.144872924375
서울특별시 강서구 염창동 염창2차한화꿈에그린,강서구,염창동,"[37.5517172093603, 126.866856399748]",37.5517172093603,126.866856399748
서울특별시 도봉구 방학동 벽산1,도봉구,방학동,"[37.6604565423523, 127.032527356121]",37.6604565423523,127.032527356121
서울특별시 동대문구 답십리동 세양청마루,동대문구,답십리동,"[37.5736828896399, 127.065549232177]",37.5736828896399,127.065549232177
서울특별시 강서구 내발산동 강서월드메르디앙,강서구,내발산동,"[37.556864954614, 126.843013179215]",37.556864954614,126.843013179215
서울특별시 송파구 문정동 문정시영,송파구,문정동,"[37.4905977165307, 127.135446483827]",37.4905977165307,127.135446483827
서울특별시 노원구 공릉동 공릉1동삼익,노원구,공릉동,"[37.618099694586, 127.072325173996]",37.618099694586,127.072325173996
서울특별시 관악구 봉천동 봉천동아제2,관악구,봉천동,"[37.4878994268212, 126.956180545631]",37.4878994268212,126.956180545631
서울특별시 구로구 오류동 오류동 영풍마드레빌,구로구,오류동,"[37.4915379834557, 126.838640730471]",37.4915379834557,126.838640730471
서울특별시 송파구 송파동 송파미성,송파구,송파동,"[37.5059447033373, 127.119255426618]",37.5059447033373,127.119255426618
서울특별시 성동구 마장동 마장현대,성동구,마장동,"[37.5694595542901, 127.042547908615]",37.5694595542901,127.042547908615
서울특별시 양천구 신월동 신월대방샤인힐,양천구,신월동,"[37.520464450295, 126.838505157117]",37.520464450295,126.838505157117
서울특별시 성북구 길음동 길음동부제2,성북구,길음동,"[37.6097712936186, 127.02577471458]",37.6097712936186,127.02577471458
서울특별시 서초구 우면동 서초네이처힐5단지,서초구,우면동,"[37.4625185396563, 127.024829425927]",37.4625185396563,127.024829425927
서울특별시 광진구 광장동 광장현대8단지,광진구,광장동,"[37.541939865593, 127.099671092254]",37.541939865593,127.099671092254
서울특별시 성동구 성수동1가 성수현대그린,성동구,성수동1가,"[37.5407234873627, 127.05035766918]",37.5407234873627,127.05035766918
서울특별시 양천구 목동 목동부영그린타운2차,양천구,목동,"[37.5363537343598, 126.881122266784]",37.5363537343598,126.881122266784
서울특별시 영등포구 양평동2가 양평상록수,영등포구,양평동2가,"[37.5237774483018, 126.883540257535]",37.5237774483018,126.883540257535
서울특별시 동대문구 용두동 용두신동아,동대문구,용두동,"[37.5726984528529, 127.032314709479]",37.5726984528529,127.032314709479
서울특별시 서초구 서초동 서초1차e편한세상,서초구,서초동,"[37.4811480824098, 127.006787516275]",37.4811480824098,127.006787516275
서울특별시 금천구 가산동 가산삼익아파트,금천구,가산동,"[37.4728973966473, 126.892996299156]",37.4728973966473,126.892996299156
서울특별시 은평구 갈현동 갈현현대1차,은평구,갈현동,"[37.6222185598846, 126.914226401537]",37.6222185598846,126.914226401537
서울특별시 노원구 상계동 상계마들,노원구,상계동,"[37.6416837711262, 127.056947974348]",37.6416837711262,127.056947974348
서울특별시 도봉구 창동 창동삼성,도봉구,창동,"[37.6490832554147, 127.04854019084]",37.6490832554147,127.04854019084
서울특별시 영등포구 신길동 신길삼성,영등포구,신길동,"[37.4963597218514, 126.911248303182]",37.4963597218514,126.911248303182
서울특별시 성북구 하월곡동 월곡두산위브아파트,성북구,하월곡동,"[37.607033098723, 127.038365407563]",37.607033098723,127.038365407563
서울특별시 도봉구 쌍문동 쌍문성원,도봉구,쌍문동,"[37.6584134290763, 127.02890230168]",37.6584134290763,127.02890230168
서울특별시 마포구 성산동 성산월드타운대림,마포구,성산동,"[37.569343987133, 126.908243398976]",37.569343987133,126.908243398976
서울특별시 서대문구 홍제동 홍제남양,서대문구,홍제동,"[37.5887847328743, 126.93816134376]",37.5887847328743,126.93816134376
서울특별시 도봉구 창동 창동주공4단지,도봉구,창동,"[37.645841010278, 127.048016739909]",37.645841010278,127.048016739909
서울특별시 마포구 염리동 마포자이,마포구,염리동,"[37.5433260217064, 126.945184422483]",37.5433260217064,126.945184422483
서울특별시 서대문구 홍제동 홍제청구3차,서대문구,홍제동,"[37.5804551106268, 126.952937878478]",37.5804551106268,126.952937878478
서울특별시 서초구 잠원동 신반포청구,서초구,잠원동,"[37.5141394987212, 127.008452668417]",37.5141394987212,127.008452668417
서울특별시 서대문구 홍은동 홍은극동,서대문구,홍은동,"[37.6026153795328, 126.950968524813]",37.6026153795328,126.950968524813
서울특별시 용산구 청암동 청암자이,용산구,청암동,"[37.5350074800767, 126.94723103582]",37.5350074800767,126.94723103582
서울특별시 관악구 신림동 관악산휴먼시아3단지,관악구,신림동,"[37.4606732370184, 126.918450856725]",37.4606732370184,126.918450856725
서울특별시 송파구 가락동 가락한신,송파구,가락동,"[37.4896792863336, 127.121735961606]",37.4896792863336,127.121735961606
서울특별시 서초구 방배동 방배임광3차,서초구,방배동,"[37.4763217936875, 127.003323898662]",37.4763217936875,127.003323898662
서울특별시 구로구 구로동 구로성호주상복합,구로구,구로동,"[37.4969004814267, 126.891373669998]",37.4969004814267,126.891373669998
서울특별시 은평구 진관동 은평뉴타운상림마을10단지,은평구,진관동,"[37.644833690056, 126.927730495248]",37.644833690056,126.927730495248
서울특별시 노원구 상계동 상계벽산,노원구,상계동,"[37.6614531070852, 127.072881636874]",37.6614531070852,127.072881636874
서울특별시 영등포구 문래동6가 문래현대1차,영등포구,문래동6가,"[37.5195213830079, 126.882810920265]",37.5195213830079,126.882810920265
서울특별시 동작구 본동 본동삼성래미안아파트,동작구,본동,"[37.5100164382346, 126.950079418788]",37.5100164382346,126.950079418788
서울특별시 강서구 등촌동 등촌태영,강서구,등촌동,"[37.5557025027625, 126.864090588329]",37.5557025027625,126.864090588329
서울특별시 송파구 문정동 문정푸르지오1차,송파구,문정동,"[37.4868780773275, 127.128105384944]",37.4868780773275,127.128105384944
서울특별시 도봉구 쌍문동 쌍문금호1차아파트,도봉구,쌍문동,"[37.6590640812439, 127.033472037939]",37.6590640812439,127.033472037939
서울특별시 성동구 옥수동 옥수삼성,성동구,옥수동,"[37.5424312325016, 127.014052103004]",37.5424312325016,127.014052103004
서울특별시 노원구 공릉동 청솔아파트8,노원구,공릉동,"[37.6232695689707, 127.086010646808]",37.6232695689707,127.086010646808
서울특별시 영등포구 양평동4가 양평성원,영등포구,양평동4가,"[37.5342936373846, 126.893936076898]",37.5342936373846,126.893936076898
서울특별시 중구 신당동 청구e편한세상(분양),중구,신당동,"[37.5604485958729, 127.016730517193]",37.5604485958729,127.016730517193
서울특별시 도봉구 도봉동 도봉한신,도봉구,도봉동,"[37.6857374077837, 127.048060587395]",37.6857374077837,127.048060587395
서울특별시 강남구 삼성동 삼성힐스테이트1단지,강남구,삼성동,"[37.5163123563071, 127.048472953744]",37.5163123563071,127.048472953744
서울특별시 강남구 대치동 대치포스코더샵,강남구,대치동,"[37.5039585509104, 127.057041795103]",37.5039585509104,127.057041795103
서울특별시 노원구 중계동 중계경남아너스빌,노원구,중계동,"[37.6620722057411, 127.077079604212]",37.6620722057411,127.077079604212
서울특별시 서대문구 북가좌동 북가좌삼호,서대문구,북가좌동,"[37.576494133858, 126.913171050724]",37.576494133858,126.913171050724
서울특별시 양천구 신정동 신정삼성SH임대,양천구,신정동,"[37.5169387724416, 126.876554489952]",37.5169387724416,126.876554489952
서울특별시 동작구 상도동 힐스테이트상도센트럴파크,동작구,상도동,"[37.495409757977, 126.950873258289]",37.495409757977,126.950873258289
서울특별시 서초구 서초동 서초현대4차,서초구,서초동,"[37.500349203223, 127.017838500607]",37.500349203223,127.017838500607
서울특별시 도봉구 창동 초안산신도브래뉴,도봉구,창동,"[37.6334329434769, 127.04255535448]",37.6334329434769,127.04255535448
서울특별시 구로구 개봉동 대상,구로구,개봉동,"[37.4823141960706, 126.849781656303]",37.4823141960706,126.849781656303
서울특별시 송파구 거여동 거여현대1차,송파구,거여동,"[37.4928499146725, 127.141031891927]",37.4928499146725,127.141031891927
서울특별시 성북구 돈암동 돈암범양,성북구,돈암동,"[37.6033317626866, 127.028043185355]",37.6033317626866,127.028043185355
서울특별시 마포구 중동 마포중동현대,마포구,중동,"[37.5711389667522, 126.906884530156]",37.5711389667522,126.906884530156
서울특별시 노원구 중계동 중계청구3차,노원구,중계동,"[37.6498275508447, 127.074331602869]",37.6498275508447,127.074331602869
서울특별시 도봉구 도봉동 도봉서광,도봉구,도봉동,"[37.6781307397219, 127.049749156878]",37.6781307397219,127.049749156878
서울특별시 성북구 종암동 종암삼성래미안,성북구,종암동,"[37.6009876756256, 127.030155293619]",37.6009876756256,127.030155293619
서울특별시 강북구 번동 번동동문아파트,강북구,번동,"[37.6239783197816, 127.038174633568]",37.6239783197816,127.038174633568
서울특별시 중랑구 중화동 중화한신아파트,중랑구,중화동,"[37.5971495731568, 127.081907230062]",37.5971495731568,127.081907230062
서울특별시 은평구 진관동 은평뉴타운박석고개제12단지아파트,은평구,진관동,"[37.6318935180295, 126.920109717787]",37.6318935180295,126.920109717787
서울특별시 강남구 대치동 은마,강남구,대치동,"[37.4974180026259, 127.065327020175]",37.4974180026259,127.065327020175
서울특별시 노원구 하계동 하계학여울청구A,노원구,하계동,"[37.6337929300075, 127.063508132928]",37.6337929300075,127.063508132928
서울특별시 서대문구 대현동 신촌럭키,서대문구,대현동,"[37.5596039122151, 126.947581754502]",37.5596039122151,126.947581754502
서울특별시 성동구 행당동 서울숲행당푸르지오,성동구,행당동,"[37.5551988096516, 127.032469328395]",37.5551988096516,127.032469328395
서울특별시 은평구 갈현동 갈현미미,은평구,갈현동,"[37.6189925230757, 126.913538710261]",37.6189925230757,126.913538710261
서울특별시 서초구 서초동 서초삼성쉐르빌2,서초구,서초동,"[37.4939600245321, 127.02788124423]",37.4939600245321,127.02788124423
서울특별시 은평구 진관동 은평뉴타운박석고개13단지아파트,은평구,진관동,"[37.6306462940032, 126.921332402925]",37.6306462940032,126.921332402925
서울특별시 양천구 신정동 유원목동,양천구,신정동,"[37.5218453798663, 126.873337347008]",37.5218453798663,126.873337347008
서울특별시 동작구 신대방동 신대방경남아너스빌,동작구,신대방동,"[37.4894876099441, 126.908593434869]",37.4894876099441,126.908593434869
서울특별시 구로구 오류동 오류동부골든SH임대,구로구,오류동,"[37.4992909110144, 126.839531583839]",37.4992909110144,126.839531583839
서울특별시 성북구 석관동 석관코오롱,성북구,석관동,"[37.606282766343, 127.065717692893]",37.606282766343,127.065717692893
서울특별시 성동구 옥수동 옥수중앙하이츠,성동구,옥수동,"[37.539617167963, 127.015956898092]",37.539617167963,127.015956898092
서울특별시 서대문구 홍제동 홍제한양,서대문구,홍제동,"[37.5833210740055, 126.946971087746]",37.5833210740055,126.946971087746
서울특별시 성북구 길음동 길음삼부,성북구,길음동,"[37.6027726439023, 127.023775903506]",37.6027726439023,127.023775903506
서울특별시 서초구 서초동 아남,서초구,서초동,"[37.4930044362233, 127.020785968907]",37.4930044362233,127.020785968907
서울특별시 성북구 하월곡동 래미안월곡,성북구,하월곡동,"[37.610440395666, 127.036873189543]",37.610440395666,127.036873189543
서울특별시 구로구 개봉동 개봉상우,구로구,개봉동,"[37.4936986929115, 126.860969951003]",37.4936986929115,126.860969951003
서울특별시 노원구 중계동 삼창타워프라자,노원구,중계동,"[37.6590546172174, 127.072714963046]",37.6590546172174,127.072714963046
서울특별시 서초구 반포동 래미안퍼스티지,서초구,반포동,"[37.502931388892, 126.9992463413]",37.502931388892,126.9992463413
서울특별시 도봉구 방학동 방학신동아1단지,도봉구,방학동,"[37.6609347988243, 127.0267260331]",37.6609347988243,127.0267260331
서울특별시 강동구 길동 청광플러스원큐브3차,강동구,길동,"[37.536374560704, 127.13645124999]",37.536374560704,127.13645124999
서울특별시 마포구 염리동 염리상록,마포구,염리동,"[37.5515563766668, 126.94797600816]",37.5515563766668,126.94797600816
서울특별시 성동구 응봉동 응봉대림강변,성동구,응봉동,"[37.5534299267708, 127.03574110661]",37.5534299267708,127.03574110661
서울특별시 서초구 잠원동 잠원신화,서초구,잠원동,"[37.5156853413098, 127.013422474976]",37.5156853413098,127.013422474976
서울특별시 성동구 하왕십리동 금호베스트빌아파트 제2관리사무소,성동구,하왕십리동,"[37.5619385256807, 127.025554837055]",37.5619385256807,127.025554837055
"서울특별시 광진구 광장동 광장삼성1,2차",광진구,광장동,"[37.5423978665881, 127.102070105349]",37.5423978665881,127.102070105349
서울특별시 서대문구 냉천동 돈의문센트레빌,서대문구,냉천동,"[37.566139089896, 126.961583473485]",37.566139089896,126.961583473485
서울특별시 서초구 반포동 엠브이아파트,서초구,반포동,"[37.4992010512641, 127.010261190544]",37.4992010512641,127.010261190544
서울특별시 노원구 상계동 상계코오롱,노원구,상계동,"[37.6527020046054, 127.069828720855]",37.6527020046054,127.069828720855
서울특별시 강동구 천호동 천호두산위브센티움,강동구,천호동,"[37.5394152598787, 127.126995720254]",37.5394152598787,127.126995720254
서울특별시 노원구 공릉동 공릉대주파크빌,노원구,공릉동,"[37.6211555272767, 127.072254959985]",37.6211555272767,127.072254959985
서울특별시 중랑구 신내동 신내동성1차2차,중랑구,신내동,"[37.6091161460678, 127.097679388152]",37.6091161460678,127.097679388152
서울특별시 송파구 문정동 문정푸르지오2차,송파구,문정동,"[37.4868398548048, 127.127290087089]",37.4868398548048,127.127290087089
서울특별시 동작구 대방동 대방대림,동작구,대방동,"[37.5072946636747, 126.924711747263]",37.5072946636747,126.924711747263
서울특별시 동작구 대방동 대방경남아너스빌,동작구,대방동,"[37.5114582912698, 126.925701096167]",37.5114582912698,126.925701096167
서울특별시 용산구 효창동 효창파크푸르지오,용산구,효창동,"[37.5401200964415, 126.958208884069]",37.5401200964415,126.958208884069
서울특별시 강남구 일원동 일원동 수서아파트,강남구,일원동,"[37.4926342499883, 127.090283572636]",37.4926342499883,127.090283572636
서울특별시 마포구 신수동 신수현대,마포구,신수동,"[37.5430851449315, 126.936978849658]",37.5430851449315,126.936978849658
서울특별시 성동구 하왕십리동 무학현대,성동구,하왕십리동,"[37.5611862139671, 127.027854212704]",37.5611862139671,127.027854212704
서울특별시 동대문구 답십리동 답십리동답한신,동대문구,답십리동,"[37.5708103275802, 127.062579152969]",37.5708103275802,127.062579152969
서울특별시 동작구 상도동 상도동원베네스트,동작구,상도동,"[37.5029265154295, 126.944420390998]",37.5029265154295,126.944420390998
서울특별시 서대문구 홍제동 인왕산벽산아파트,서대문구,홍제동,"[37.5923849024246, 126.948447054576]",37.5923849024246,126.948447054576
서울특별시 동대문구 휘경동 휘경주공2단지,동대문구,휘경동,"[37.5829871567703, 127.070747052227]",37.5829871567703,127.070747052227
서울특별시 도봉구 쌍문동 쌍문한양7차,도봉구,쌍문동,"[37.6560145987519, 127.033853936885]",37.6560145987519,127.033853936885
서울특별시 영등포구 당산동3가 당산SHVILLE,영등포구,당산동3가,"[37.5242094426054, 126.901521885042]",37.5242094426054,126.901521885042
서울특별시 노원구 월계동 월계역신도브래뉴,노원구,월계동,"[37.6290365148079, 127.058675545978]",37.6290365148079,127.058675545978
서울특별시 강서구 등촌동 등촌주공7단지,강서구,등촌동,"[37.56080406349, 126.851687961989]",37.56080406349,126.851687961989
서울특별시 마포구 도화동 도화현대,마포구,도화동,"[37.5402564246836, 126.953870961641]",37.5402564246836,126.953870961641
서울특별시 구로구 고척동 고척벽산블루밍,구로구,고척동,"[37.4957004752141, 126.864395031441]",37.4957004752141,126.864395031441
서울특별시 서초구 방배동 방배디오빌,서초구,방배동,"[37.486044022746, 126.984200927218]",37.486044022746,126.984200927218
서울특별시 성북구 삼선동3가 삼선SKView,성북구,삼선동3가,"[37.5873141701073, 127.011639179336]",37.5873141701073,127.011639179336
서울특별시 강남구 역삼동 역삼2차아이파크,강남구,역삼동,"[37.4967695014167, 127.051582815175]",37.4967695014167,127.051582815175
서울특별시 마포구 상암동 DMC상암센트럴파크1단지,마포구,상암동,"[37.5742846533291, 126.896137421556]",37.5742846533291,126.896137421556
서울특별시 서대문구 홍제동 홍제무악청구1차,서대문구,홍제동,"[37.5819153538654, 126.95204947944]",37.5819153538654,126.95204947944
서울특별시 서초구 서초동 래미안 서초스위트 아파트,서초구,서초동,"[37.5022952134583, 127.020505472248]",37.5022952134583,127.020505472248
서울특별시 강남구 삼성동 삼성롯데,강남구,삼성동,"[37.5176763813954, 127.048701765343]",37.5176763813954,127.048701765343
서울특별시 광진구 광장동 광장동금호베스트빌,광진구,광장동,"[37.5437532629126, 127.094011537775]",37.5437532629126,127.094011537775
서울특별시 강서구 가양동 강서한강자이,강서구,가양동,"[37.5664868440078, 126.849144523266]",37.5664868440078,126.849144523266
