address,address_gu,address_dong,lat_long,lat,long
서울특별시 성동구 도선동 성동삼성쉐르빌,성동구,도선동,"[37.5643939504204, 127.034936605036]",37.5643939504204,127.034936605036
서울특별시 강남구 역삼동 역삼경남,강남구,역삼동,"[37.5005715581119, 127.04231099391]",37.5005715581119,127.04231099391
서울특별시 서초구 서초동 서초우성5차아파트,서초구,서초동,"[37.4948498686503, 127.026668659083]",37.4948498686503,127.026668659083
서울특별시 성동구 성수동1가 성수쌍용,성동구,성수동1가,"[37.5495119117826, 127.047110331737]",37.5495119117826,127.047110331737
서울특별시 영등포구 대림동 대림갑을명가,영등포구,대림동,"[37.4956735475526, 126.903696863133]",37.4956735475526,126.903696863133
서울특별시 영등포구 당산동5가 당산디오빌,영등포구,당산동5가,"[37.5332349430411, 126.902268281463]",37.5332349430411,126.902268281463
서울특별시 마포구 성산동 성산시영아파트,마포구,성산동,"[37.5721152959697, 126.901892164797]",37.5721152959697,126.901892164797
서울특별시 은평구 진관동 은평뉴타운마고정11단지,은평구,진관동,"[37.6320493391686, 126.925973863366]",37.6320493391686,126.925973863366
서울특별시 성동구 금호동3가 금호두산,성동구,금호동3가,"[37.5500382701277, 127.016217362383]",37.5500382701277,127.016217362383
서울특별시 도봉구 창동 창동주공2단지,도봉구,창동,"[37.6527358103485, 127.042299723487]",37.6527358103485,127.042299723487
서울특별시 양천구 목동 목동진도2차,양천구,목동,"[37.5256633242838, 126.873794491883]",37.5256633242838,126.873794491883
서울특별시 동작구 상도동 상도두산위브,동작구,상도동,"[37.5046327696867, 126.94332525587]",37.5046327696867,126.94332525587
서울특별시 노원구 중계동 중계경남롯데상아,노원구,중계동,"[37.6387855630708, 127.062487927133]",37.6387855630708,127.062487927133
서울특별시 송파구 마천동 마천금호어울림2차,송파구,마천동,"[37.4932452222868, 127.155368155079]",37.4932452222868,127.155368155079
서울특별시 중구 신당동 약수하이츠아파트(임대),중구,신당동,"[37.5547365066187, 127.014263668771]",37.5547365066187,127.014263668771
서울특별시 강서구 방화동 마곡서광2차아파트,강서구,방화동,"[37.5720215579008, 126.81068023575]",37.5720215579008,126.81068023575
서울특별시 은평구 진관동 은평뉴타운상림마을4단지,은평구,진관동,"[37.6470178993725, 126.927656652397]",37.6470178993725,126.927656652397
서울특별시 동대문구 휘경동 휘경롯데낙천대,동대문구,휘경동,"[37.5919735169804, 127.064380106947]",37.5919735169804,127.064380106947
서울특별시 은평구 불광동 불광롯데캐슬,은평구,불광동,"[37.6129093305885, 126.93310434473]",37.6129093305885,126.93310434473
서울특별시 강동구 성내동 성내성안청구,강동구,성내동,"[37.5317120804393, 127.124531649095]",37.5317120804393,127.124531649095
서울특별시 영등포구 당산동5가 당산효성1차,영등포구,당산동5가,"[37.530620458402, 126.901773216588]",37.530620458402,126.901773216588
서울특별시 노원구 월계동 월계극동,노원구,월계동,"[37.6295411399429, 127.045906276065]",37.6295411399429,127.045906276065
서울특별시 은평구 진관동 은평뉴타운우물골5단지,은평구,진관동,"[37.6345637179012, 126.927568123722]",37.6345637179012,126.927568123722
서울특별시 관악구 신림동 신림주공2단지,관악구,신림동,"[37.4640458881741, 126.926531939083]",37.4640458881741,126.926531939083
서울특별시 관악구 신림동 신림우방,관악구,신림동,"[37.4889356289722, 126.918798258761]",37.4889356289722,126.918798258761
서울특별시 송파구 잠실동 잠실리센츠,송파구,잠실동,"[37.5127510583527, 127.088417185047]",37.5127510583527,127.088417185047
서울특별시 송파구 가락동 송파동부센트레빌,송파구,가락동,"[37.5002551124329, 127.108815865347]",37.5002551124329,127.108815865347
서울특별시 노원구 공릉동 공릉해링턴플레이스(구.효성화운트빌),노원구,공릉동,"[37.627737624921, 127.086908237543]",37.627737624921,127.086908237543
서울특별시 용산구 한강로1가 대우월드마크용산,용산구,한강로1가,"[37.5371756077648, 126.972984984131]",37.5371756077648,126.972984984131
서울특별시 중랑구 면목동 용마금호타운,중랑구,면목동,"[37.5827673646121, 127.094265154541]",37.5827673646121,127.094265154541
서울특별시 은평구 진관동 은평뉴타운제각말5단지제1,은평구,진관동,"[37.6364004361044, 126.935760587979]",37.6364004361044,126.935760587979
서울특별시 영등포구 대림동 대림3동현대아파트,영등포구,대림동,"[37.5021418472898, 126.894898417631]",37.5021418472898,126.894898417631
서울특별시 노원구 공릉동 공릉우방4단지,노원구,공릉동,"[37.6266499248028, 127.087314103707]",37.6266499248028,127.087314103707
서울특별시 용산구 이촌동 이촌대림,용산구,이촌동,"[37.5252183146702, 126.954928463642]",37.5252183146702,126.954928463642
서울특별시 중랑구 상봉동 상봉우정,중랑구,상봉동,"[37.5994293182578, 127.088683853976]",37.5994293182578,127.088683853976
서울특별시 동작구 흑석동 흑석동양,동작구,흑석동,"[37.5003956774642, 126.958695268933]",37.5003956774642,126.958695268933
서울특별시 동대문구 답십리동 신답경남아파트,동대문구,답십리동,"[37.5747568063894, 127.044656716439]",37.5747568063894,127.044656716439
서울특별시 성동구 성수동2가 성수우방2차,성동구,성수동2가,"[37.5484499945307, 127.051841904023]",37.5484499945307,127.051841904023
서울특별시 노원구 하계동 하계미성,노원구,하계동,"[37.634682675193, 127.069541310656]",37.634682675193,127.069541310656
서울특별시 중구 신당동 래미안신당하이베르,중구,신당동,"[37.5616192513453, 127.022720407044]",37.5616192513453,127.022720407044
서울특별시 강서구 화곡동 우장산롯데캐슬,강서구,화곡동,"[37.5556368030986, 126.848318501804]",37.5556368030986,126.848318501804
서울특별시 송파구 잠실동 갤러리아팰리스,송파구,잠실동,"[37.5111038313694, 127.093918656887]",37.5111038313694,127.093918656887
서울특별시 종로구 숭인동 롯데캐슬천지인,종로구,숭인동,"[37.5738517068991, 127.016177810477]",37.5738517068991,127.016177810477
서울특별시 동작구 흑석동 명수대현대아파트,동작구,흑석동,"[37.5078356376452, 126.966995755893]",37.5078356376452,126.966995755893
서울특별시 송파구 문정동 문정3차푸르지오,송파구,문정동,"[37.4871169853133, 127.133272419016]",37.4871169853133,127.133272419016
서울특별시 동대문구 장안동 장안현대힐스테이트,동대문구,장안동,"[37.5759645757228, 127.075350090148]",37.5759645757228,127.075350090148
서울특별시 노원구 공릉동 공릉삼익1차아파트,노원구,공릉동,"[37.6269131279747, 127.082005016461]",37.6269131279747,127.082005016461
서울특별시 성동구 금호동4가 서울숲2차푸르지오,성동구,금호동4가,"[37.5461200187428, 127.024069426318]",37.5461200187428,127.024069426318
서울특별시 용산구 이촌동 LG한강자이,용산구,이촌동,"[37.5199475597514, 126.971107300788]",37.5199475597514,126.971107300788
서울특별시 강남구 일원동 한솔마을,강남구,일원동,"[37.4820202153818, 127.07784941621]",37.4820202153818,127.07784941621
서울특별시 구로구 고척동 고척서울가든,구로구,고척동,"[37.5026965980834, 126.860597588858]",37.5026965980834,126.860597588858
서울특별시 서대문구 충정로3가 충정리시온,서대문구,충정로3가,"[37.5602879536747, 126.964843138591]",37.5602879536747,126.964843138591
서울특별시 서대문구 홍은동 홍은풍림아이원,서대문구,홍은동,"[37.6036449199212, 126.948383228249]",37.6036449199212,126.948383228249
서울특별시 서초구 방배동 방배신동아,서초구,방배동,"[37.48087049251, 127.000944622859]",37.48087049251,127.000944622859
서울특별시 성동구 금호동4가 브라운스톤금호아파트,성동구,금호동4가,"[37.5466546398967, 127.01569586672]",37.5466546398967,127.01569586672
서울특별시 노원구 중계동 중계주공3단지,노원구,중계동,"[37.6566034796278, 127.076167903538]",37.6566034796278,127.076167903538
서울특별시 양천구 신월동 신월서울가든,양천구,신월동,"[37.5252977950342, 126.848649985014]",37.5252977950342,126.848649985014
서울특별시 구로구 개봉동 청실아파트,구로구,개봉동,"[37.4954826154734, 126.859767401812]",37.4954826154734,126.859767401812
서울특별시 은평구 수색동 DMC진흥아파트,은평구,수색동,"[37.5853704589019, 126.900295145391]",37.5853704589019,126.900295145391
서울특별시 강동구 암사동 암사선사현대,강동구,암사동,"[37.5523963093311, 127.125814420892]",37.5523963093311,127.125814420892
서울특별시 영등포구 양평동2가 양평벽산,영등포구,양평동2가,"[37.5222797950425, 126.882985680027]",37.5222797950425,126.882985680027
서울특별시 강남구 일원동 수서1-1단지아파트,강남구,일원동,"[37.4926342499883, 127.090283572636]",37.4926342499883,127.090283572636
서울특별시 광진구 광장동 광장현대9차,광진구,광장동,"[37.5425100035878, 127.097748124229]",37.5425100035878,127.097748124229
서울특별시 강동구 암사동 암사한강현대,강동구,암사동,"[37.5552096720912, 127.131924490362]",37.5552096720912,127.131924490362
서울특별시 서초구 반포동 반포푸르지오,서초구,반포동,"[37.5038886565254, 126.996453891018]",37.5038886565254,126.996453891018
서울특별시 광진구 광장동 광장힐스테이트,광진구,광장동,"[37.5431780182608, 127.099564904065]",37.5431780182608,127.099564904065
서울특별시 광진구 자양동 자양더샵스타시티,광진구,자양동,"[37.5378031898538, 127.072632021718]",37.5378031898538,127.072632021718
서울특별시 중랑구 신내동 신내동성4차,중랑구,신내동,"[37.6067265670772, 127.096444206008]",37.6067265670772,127.096444206008
"서울특별시 서초구 서초동 서초현대1,2차",서초구,서초동,"[37.4867903061507, 127.025675868573]",37.4867903061507,127.025675868573
서울특별시 광진구 자양동 자양현대홈타운8차,광진구,자양동,"[37.5334859623824, 127.07203305701]",37.5334859623824,127.07203305701
서울특별시 동대문구 휘경동 휘경베스트빌현대,동대문구,휘경동,"[37.5816647278231, 127.074189400955]",37.5816647278231,127.074189400955
서울특별시 중랑구 신내동 신내10단지,중랑구,신내동,"[37.6092681272483, 127.094601887195]",37.6092681272483,127.094601887195
서울특별시 강동구 성내동 성내삼성,강동구,성내동,"[37.5307605206146, 127.125987937235]",37.5307605206146,127.125987937235
서울특별시 광진구 자양동 자양현대,광진구,자양동,"[37.5281164204926, 127.082406512435]",37.5281164204926,127.082406512435
서울특별시 강남구 도곡동 도곡현대,강남구,도곡동,"[37.4889635443741, 127.038017284005]",37.4889635443741,127.038017284005
서울특별시 영등포구 영등포동 영등포푸르지오,영등포구,영등포동,"[37.5115335007354, 126.90238989779]",37.5115335007354,126.90238989779
서울특별시 마포구 창전동 서강한화오벨리스크스위트,마포구,창전동,"[37.5465344912559, 126.9317231782]",37.5465344912559,126.9317231782
서울특별시 강남구 역삼동 개나리SKVIEW,강남구,역삼동,"[37.5014129423797, 127.049867919661]",37.5014129423797,127.049867919661
서울특별시 도봉구 창동 창동대우그린아파트,도봉구,창동,"[37.6463903314851, 127.049562431563]",37.6463903314851,127.049562431563
서울특별시 노원구 공릉동 공릉2단지라이프,노원구,공릉동,"[37.6305877904328, 127.066724120963]",37.6305877904328,127.066724120963
서울특별시 도봉구 창동 창동상아1차,도봉구,창동,"[37.6540057213893, 127.042366397692]",37.6540057213893,127.042366397692
서울특별시 동대문구 답십리동 답십리두산제2,동대문구,답십리동,"[37.5693345701267, 127.059475261101]",37.5693345701267,127.059475261101
서울특별시 관악구 신림동 삼성산주공3단지,관악구,신림동,"[37.46250743022, 126.926129237992]",37.46250743022,126.926129237992
서울특별시 구로구 구로동 구로한신휴플러스,구로구,구로동,"[37.4885093277413, 126.890801238217]",37.4885093277413,126.890801238217
서울특별시 도봉구 방학동 방학극동아파트,도봉구,방학동,"[37.6645080610932, 127.026854480279]",37.6645080610932,127.026854480279
서울특별시 성동구 응봉동 응봉금호현대,성동구,응봉동,"[37.5510468773952, 127.030954035723]",37.5510468773952,127.030954035723
서울특별시 구로구 구로동 구로보광,구로구,구로동,"[37.495322650409, 126.886029866482]",37.495322650409,126.886029866482
서울특별시 동대문구 장안동 장안삼성쉐르빌,동대문구,장안동,"[37.5716707486031, 127.069859628795]",37.5716707486031,127.069859628795
서울특별시 강남구 도곡동 역삼럭키,강남구,도곡동,"[37.4904503641949, 127.039997193037]",37.4904503641949,127.039997193037
서울특별시 관악구 신림동 신림벽산블루밍,관악구,신림동,"[37.4638903779024, 126.931178515716]",37.4638903779024,126.931178515716
서울특별시 강서구 등촌동 등촌동성,강서구,등촌동,"[37.5638696352592, 126.845798929518]",37.5638696352592,126.845798929518
서울특별시 동작구 대방동 대방현대1차,동작구,대방동,"[37.5126764953218, 126.930821677746]",37.5126764953218,126.930821677746
서울특별시 마포구 아현동 서서울삼성아파트,마포구,아현동,"[37.5564806162716, 126.959256236895]",37.5564806162716,126.959256236895
서울특별시 동작구 신대방동 신대방우성2차,동작구,신대방동,"[37.4929218294824, 126.910397720888]",37.4929218294824,126.910397720888
서울특별시 구로구 고척동 고척마젤란,구로구,고척동,"[37.5043033937635, 126.86410600678]",37.5043033937635,126.86410600678
서울특별시 중랑구 면목동 면목경남아너스빌,중랑구,면목동,"[37.5754872890389, 127.080447509343]",37.5754872890389,127.080447509343
서울특별시 강서구 방화동 방화동 개화아파트,강서구,방화동,"[37.5807528992991, 126.812541288959]",37.5807528992991,126.812541288959
서울특별시 동대문구 휘경동 휘경서울가든,동대문구,휘경동,"[37.5841614840074, 127.071092342585]",37.5841614840074,127.071092342585
서울특별시 강남구 개포동 개포현대1차,강남구,개포동,"[37.4826695293008, 127.054425938151]",37.4826695293008,127.054425938151
서울특별시 송파구 거여동 거여3단지,송파구,거여동,"[37.4899322649633, 127.147676534825]",37.4899322649633,127.147676534825
서울특별시 송파구 가락동 한화오벨리스크,송파구,가락동,"[37.4948258197176, 127.121927507127]",37.4948258197176,127.121927507127
서울특별시 구로구 신도림동 신도림동아2차,구로구,신도림동,"[37.5085457625955, 126.885892478427]",37.5085457625955,126.885892478427
서울특별시 양천구 목동 목동트라팰리스,양천구,목동,"[37.52599390147, 126.870383328651]",37.52599390147,126.870383328651
서울특별시 양천구 신월동 신월신안파크,양천구,신월동,"[37.5233765603266, 126.829579444411]",37.5233765603266,126.829579444411
서울특별시 광진구 자양동 자양우성1차,광진구,자양동,"[37.5344089874125, 127.075573577702]",37.5344089874125,127.075573577702
서울특별시 도봉구 도봉동 도봉래미안,도봉구,도봉동,"[37.6794935934997, 127.046578551654]",37.6794935934997,127.046578551654
서울특별시 서초구 서초동 서초삼풍,서초구,서초동,"[37.4987321235919, 127.015601806503]",37.4987321235919,127.015601806503
서울특별시 노원구 월계동 월계청백1단지,노원구,월계동,"[37.6355940610603, 127.051557065406]",37.6355940610603,127.051557065406
서울특별시 은평구 불광동 북한산수자인,은평구,불광동,"[37.6216892860099, 126.932170239348]",37.6216892860099,126.932170239348
서울특별시 강남구 역삼동 역삼래미안펜타빌,강남구,역삼동,"[37.5005998907468, 127.047422022725]",37.5005998907468,127.047422022725
서울특별시 강남구 세곡동 강남엘에이치1단지,강남구,세곡동,"[37.4667907761882, 127.10286961908]",37.4667907761882,127.10286961908
서울특별시 관악구 신림동 신림미성,관악구,신림동,"[37.4825102462272, 126.903435850976]",37.4825102462272,126.903435850976
서울특별시 중랑구 묵동 묵동신안3차,중랑구,묵동,"[37.6124746884914, 127.081779175958]",37.6124746884914,127.081779175958
서울특별시 성동구 행당동 행당한진타운제2,성동구,행당동,"[37.5552832975084, 127.026431579796]",37.5552832975084,127.026431579796
서울특별시 영등포구 문래동5가 문래대림,영등포구,문래동5가,"[37.5170161035424, 126.88806349814]",37.5170161035424,126.88806349814
서울특별시 은평구 진관동 은평뉴타운마고정3단지,은평구,진관동,"[37.6333609533039, 126.927651200838]",37.6333609533039,126.927651200838
서울특별시 도봉구 방학동 방학삼성래미안1단지,도봉구,방학동,"[37.6669775389205, 127.047276059135]",37.6669775389205,127.047276059135
서울특별시 노원구 월계동 월계주공1단지,노원구,월계동,"[37.6281259684663, 127.052782051404]",37.6281259684663,127.052782051404
서울특별시 노원구 월계동 성북역신도브래뉴,노원구,월계동,"[37.6232029158151, 127.058997535197]",37.6232029158151,127.058997535197
서울특별시 도봉구 방학동 방학벽산2차,도봉구,방학동,"[37.6589255083572, 127.025138236022]",37.6589255083572,127.025138236022
서울특별시 송파구 풍납동 풍납미성,송파구,풍납동,"[37.5341796229641, 127.113752721633]",37.5341796229641,127.113752721633
서울특별시 노원구 중계동 중계주공5단지,노원구,중계동,"[37.6528314028999, 127.07592630319]",37.6528314028999,127.07592630319
서울특별시 종로구 창신동 창신두산,종로구,창신동,"[37.5742176646077, 127.014287420294]",37.5742176646077,127.014287420294
서울특별시 강서구 염창동 염창우성2차,강서구,염창동,"[37.5557240025396, 126.8694909718]",37.5557240025396,126.8694909718
서울특별시 강남구 삼성동 삼성동힐스테이트2단지,강남구,삼성동,"[37.5138589096778, 127.051485875359]",37.5138589096778,127.051485875359
서울특별시 성북구 정릉동 정릉우방아파트,성북구,정릉동,"[37.6003791426184, 127.010103849306]",37.6003791426184,127.010103849306
서울특별시 도봉구 창동 창동신창,도봉구,창동,"[37.6407409978532, 127.041844016725]",37.6407409978532,127.041844016725
서울특별시 성동구 성수동1가 성수갤러리아포레,성동구,성수동1가,"[37.5457843454815, 127.042476851287]",37.5457843454815,127.042476851287
서울특별시 구로구 개봉동 개봉한진,구로구,개봉동,"[37.4846795429977, 126.851939768222]",37.4846795429977,126.851939768222
서울특별시 성북구 종암동 종암극동아파트,성북구,종암동,"[37.5952781323054, 127.033682708793]",37.5952781323054,127.033682708793
서울특별시 양천구 신월동 수명산롯데캐슬,양천구,신월동,"[37.5445574100504, 126.828496648213]",37.5445574100504,126.828496648213
서울특별시 구로구 고척동 고척삼익1단지,구로구,고척동,"[37.5086321795224, 126.852971017596]",37.5086321795224,126.852971017596
서울특별시 노원구 상계동 상계한신3차,노원구,상계동,"[37.66622169337, 127.067489665682]",37.66622169337,127.067489665682
서울특별시 마포구 신수동 대원칸타빌,마포구,신수동,"[37.5480841409708, 126.93365853591]",37.5480841409708,126.93365853591
서울특별시 용산구 산천동 한강타운,용산구,산천동,"[37.5357557043381, 126.950212860284]",37.5357557043381,126.950212860284
서울특별시 은평구 진관동 은평뉴타운구파발9-2단지,은평구,진관동,"[37.6438624977627, 126.920017019451]",37.6438624977627,126.920017019451
서울특별시 용산구 산천동 리버힐삼성아파트,용산구,산천동,"[37.535002087034, 126.95059340676]",37.535002087034,126.95059340676
서울특별시 성북구 상월곡동 성북동아에코빌,성북구,상월곡동,"[37.6078992370885, 127.045423992015]",37.6078992370885,127.045423992015
서울특별시 강남구 삼성동 삼성한솔,강남구,삼성동,"[37.5173889752862, 127.045503680429]",37.5173889752862,127.045503680429
서울특별시 도봉구 쌍문동 쌍문동익파크,도봉구,쌍문동,"[37.6514651839656, 127.024760862104]",37.6514651839656,127.024760862104
서울특별시 강서구 방화동 방화3차우림필유,강서구,방화동,"[37.5682727499685, 126.808198355281]",37.5682727499685,126.808198355281
서울특별시 서대문구 홍은동 홍은동원베네스트,서대문구,홍은동,"[37.5989341410052, 126.943949771598]",37.5989341410052,126.943949771598
서울특별시 종로구 평창동 평창롯데,종로구,평창동,"[37.6091361348129, 126.975681166723]",37.6091361348129,126.975681166723
서울특별시 마포구 공덕동 공덕삼성,마포구,공덕동,"[37.5466962462354, 126.951444914492]",37.5466962462354,126.951444914492
서울특별시 강남구 청담동 삼성청담공원,강남구,청담동,"[37.5224202022399, 127.050536317213]",37.5224202022399,127.050536317213
서울특별시 서초구 방배동 현대멤피스아파트,서초구,방배동,"[37.4951763080247, 126.988366427362]",37.4951763080247,126.988366427362
서울특별시 영등포구 신길동 신기목련,영등포구,신길동,"[37.5084064349724, 126.914921289635]",37.5084064349724,126.914921289635
서울특별시 송파구 오금동 오금현대백조,송파구,오금동,"[37.5093910634084, 127.129259504158]",37.5093910634084,127.129259504158
서울특별시 서초구 우면동 서초네이처힐4단지,서초구,우면동,"[37.4636344096655, 127.02623346136]",37.4636344096655,127.02623346136
서울특별시 동작구 신대방동 보라매롯데낙천대,동작구,신대방동,"[37.4943314525612, 126.913661930354]",37.4943314525612,126.913661930354
서울특별시 광진구 광장동 광장현대파크빌,광진구,광장동,"[37.5441456421547, 127.101527301469]",37.5441456421547,127.101527301469
서울특별시 성동구 성수동1가 성수2차대우,성동구,성수동1가,"[37.5484104489106, 127.050153941693]",37.5484104489106,127.050153941693
서울특별시 강동구 천호동 천호동아하이빌,강동구,천호동,"[37.54471338622, 127.134419888871]",37.54471338622,127.134419888871
서울특별시 성북구 종암동 래미안세레니티,성북구,종암동,"[37.5992448373509, 127.031050089448]",37.5992448373509,127.031050089448
서울특별시 관악구 신림동 신림현대,관악구,신림동,"[37.4749935380104, 126.932280766666]",37.4749935380104,126.932280766666
서울특별시 중랑구 상봉동 신내건영1차,중랑구,상봉동,"[37.6039982711767, 127.093545075406]",37.6039982711767,127.093545075406
서울특별시 용산구 이촌동 동부이촌동우성,용산구,이촌동,"[37.5216751604394, 126.968363418261]",37.5216751604394,126.968363418261
서울특별시 강동구 천호동 천호동아코아,강동구,천호동,"[37.5412800765891, 127.125969201144]",37.5412800765891,127.125969201144
서울특별시 강남구 세곡동 세곡리엔파크4단지,강남구,세곡동,"[37.462086390367, 127.101964226816]",37.462086390367,127.101964226816
서울특별시 마포구 신공덕동 공덕아이파크,마포구,신공덕동,"[37.5446740470439, 126.95605352897]",37.5446740470439,126.95605352897
서울특별시 동작구 상도동 상도쌍용,동작구,상도동,"[37.5015273080708, 126.931642268797]",37.5015273080708,126.931642268797
서울특별시 구로구 신도림동 신도림현대,구로구,신도림동,"[37.5119722191003, 126.884254440618]",37.5119722191003,126.884254440618
서울특별시 노원구 공릉동 화랑해링턴플레이스,노원구,공릉동,"[37.6238708270864, 127.081134878842]",37.6238708270864,127.081134878842
서울특별시 중랑구 묵동 묵동브라운스톤태릉,중랑구,묵동,"[37.6187414214185, 127.08242725632]",37.6187414214185,127.08242725632
서울특별시 영등포구 문래동3가 문래공원한신,영등포구,문래동3가,"[37.5175839837132, 126.892997679027]",37.5175839837132,126.892997679027
서울특별시 노원구 상계동 상계수락한신,노원구,상계동,"[37.6738366111389, 127.060133723949]",37.6738366111389,127.060133723949
서울특별시 송파구 마천동 송파파크데일2단지,송파구,마천동,"[37.4957810716091, 127.158847774957]",37.4957810716091,127.158847774957
서울특별시 관악구 신림동 신림건영2차,관악구,신림동,"[37.4708484624297, 126.916922731166]",37.4708484624297,126.916922731166
서울특별시 동작구 사당동 남성두산위브트레지움,동작구,사당동,"[37.4853926822134, 126.971279925511]",37.4853926822134,126.971279925511
서울특별시 노원구 상계동 상계미도,노원구,상계동,"[37.6462253424076, 127.060952224108]",37.6462253424076,127.060952224108
서울특별시 서초구 서초동 서초5차e편한세상,서초구,서초동,"[37.4797223864045, 127.007279420326]",37.4797223864045,127.007279420326
서울특별시 구로구 구로동 구로현대연예인,구로구,구로동,"[37.492986322182, 126.877113407262]",37.492986322182,126.877113407262
